<?xml version="1.0" encoding="utf-8"?>
<feed xmlns:xsi="http://www.w3.org/2001/XMLSchema-instance"
      xsi:noNamespaceSchemaLocation="schema.xsd">
    <date>2015-01-01</date>
    <offers>
        <offer>
            <identificators>
                <local>1</local>
                <remote>1</remote>
            </identificators>
            <type>sell</type>
            <price>
                <value>100000</value>
                <unit>usd</unit>
            </price>
            <property>
                <type>house:chalet</type>
                <location>
                    <latitude>42.5368920079</latitude>
                    <longitude>1.669921875</longitude>
                    <address>
                        <ru>проспект Беверли-Хиллз</ru>
                        <en>Beverly Hills Avenue</en>
                    </address>
                </location>
                <title>
                    <ru>Шикарный шале в престижной зоне</ru>
                    <en>Luxurious Chalet in the prestigious area</en>
                </title>
                <article>
                    <ru>
                        <h1>Шикарный шале в престижной зоне</h1>
                        <h2>Современный шале класса люкс</h2>
                        <p>Этот шикарный шале расположен в самом лучшем районе города Ла Массана в 5 минутах от
                           спортивно-развлекательного центра Аньёс-Парк (Anyos Park), в 10 минутах от канатной дороги
                           Ла Массаны, ведущей к лыжным трассам Вальнорда и в 5 минутах от единственной в Княжестве
                           частной и престижной международной школы «Col.legi dels Pirineus».</p>
                        <h2>Современный шале класса люкс</h2>
                        <p>Современного стиля комфортабельный шале с отделкой класса люкс находится в привилегированной
                            зоне Ла Массаны, местности –Аньёс. Прекрасные виды на горы. Местонахождение и стиль делают
                            шале уникальным в этом районе.</p>
                    </ru>
                    <en>
                        <h1>Luxurious Chalet in the prestigious area</h1>
                        <h2>Modern luxury chalets</h2>
                        <p>This luxurious Chalet is located in the best area of La Massana 5 minutes from the sports
                           and entertainment centre anyós Park (Anyos Park, 10 minutes from the cable car to La Massana,
                           leading to the ski slopes of Vallnord and 5 minutes from the only in the Principality of
                           private and prestigious international school "Col.legi dels Pirineus".</p>
                        <p>Modern style comfortable Chalet with luxury finishes is located in a privileged area of
                           La Massana, location-agnès. Beautiful mountain views. The location and style make the Chalet
                           is unique in the area.</p>
                    </en>
                </article>
                <images>
                    <image>http://static.maindoor.ru/dcf91d545ec811e48e28005056006cc7.JPG</image>
                    <image>http://static.maindoor.ru/f4bbac385ed011e48e28005056006cc7.JPG</image>
                    <image>http://static.maindoor.ru/f4c0f6de5ed011e48e28005056006cc7.JPG</image>
                    <image>http://static.maindoor.ru/f4bbac385ed011e48e28005056006cc7.JPG</image>
                    <image>http://static.maindoor.ru/f4cf70385ed011e48e28005056006cc7.JPG</image>
                    <image>http://static.maindoor.ru/f4d438205ed011e48e28005056006cc7.JPG</image>
                    <image>http://static.maindoor.ru/f4d6fbbe5ed011e48e28005056006cc7.JPG</image>
                    <image>http://static.maindoor.ru/f4eca5d65ed011e48e28005056006cc7.JPG</image>
                    <image>http://static.maindoor.ru/f4fe09025ed011e48e28005056006cc7.JPG</image>
                    <image>http://static.maindoor.ru/f52d6b485ed011e48e28005056006cc7.jpg</image>
                </images>
                <properties>
                    <area>
                        <gross>560</gross>
                        <living>483</living>
                        <kitchen>90</kitchen>
                        <land>100</land>
                    </area>
                    <rooms>
                        <total>7</total>
                        <living>5</living>
                        <kitchens>1</kitchens>
                        <bathrooms>
                            <total>5</total>
                            <toilets>2</toilets>
                            <bathrooms>2</bathrooms>
                            <combined>1</combined>
                        </bathrooms>
                    </rooms>
                    <building>
                        <status>commissioned</status>
                        <material>brick</material>
                        <year>2007</year>
                        <floor>4</floor>
                        <floors>4</floors>
                    </building>
                </properties>
                <tags>
                    <tag>near_mountain</tag>
                    <tag>furniture</tag>
                    <tag>garage</tag>
                </tags>
            </property>
        </offer>
    </offers>
</feed>